{
  "$schema": "https://raw.githubusercontent.com/dougsubbertjr-cell/djson-standard/main/schema/djson-v0.1.schema.json",
  "djson_version": "0.1.0",
  "entity": {
    "name": "Juniper & Glass Skincare",
    "type": "business",
    "category": "E-commerce skincare",
    "description": "A fictional online shop selling small-batch facial-care products.",
    "url": "https://juniper-glass.example"
  },
  "trust_layer": {
    "verified": true,
    "verification_method": "The fictional business reviews its store-domain ownership and customer-support mailbox quarterly.",
    "anti_scam_policy": "Juniper & Glass Skincare accepts orders only through its listed website and never requests payment through direct messages.",
    "policy_urls": [
      "https://juniper-glass.example/policies/returns",
      "https://juniper-glass.example/policies/privacy"
    ]
  },
  "offerings": [
    {
      "name": "Cloudberry Barrier Serum",
      "type": "product",
      "status": "active",
      "description": "A fictional 30 mL facial serum packaged for standard parcel delivery.",
      "url": "https://juniper-glass.example/products/cloudberry-barrier-serum",
      "delivery_format": [
        "shipping"
      ],
      "price": 32,
      "currency": "USD"
    }
  ],
  "contact": {
    "support_email": "care@juniper-glass.example",
    "url": "https://juniper-glass.example/contact",
    "location": "Fictional Harbor District"
  },
  "last_updated": "2026-09-19T12:00:00Z"
}
