{
  "$schema": "https://raw.githubusercontent.com/dougsubbertjr-cell/djson-standard/main/schema/djson-v0.1.schema.json",
  "djson_version": "0.1.0",
  "entity": {
    "name": "Fable Peak Learning",
    "type": "business",
    "category": "Digital education",
    "description": "A fictional publisher of practical learning materials.",
    "url": "https://fable-peak-learning.example"
  },
  "trust_layer": {
    "verified": false,
    "anti_scam_policy": "Fable Peak Learning sells fictional materials only through its listed website."
  },
  "offerings": [
    {
      "name": "Planning Field Notes",
      "type": "digital_product",
      "status": "active",
      "description": "A fictional downloadable workbook for planning routines.",
      "url": "https://fable-peak-learning.example/products/planning-field-notes",
      "delivery_format": [
        "digital_download"
      ],
      "price": 18,
      "currency": "USD"
    }
  ],
  "contact": {
    "support_email": "support@fable-peak-learning.example"
  },
  "last_updated": "2026-09-19T12:00:00Z"
}
