{
  "$schema": "https://raw.githubusercontent.com/dougsubbertjr-cell/djson-standard/main/schema/djson-v0.1.schema.json",
  "djson_version": "0.1.0",
  "entity": {
    "name": "Example Digital Publisher",
    "type": "business",
    "category": "Digital products",
    "url": "https://example-digital-publisher.example"
  },
  "trust_layer": {
    "verified": false,
    "anti_scam_policy": "Replace this statement with a factual policy before publishing."
  },
  "offerings": [
    {
      "name": "Example Learning Kit",
      "type": "digital_product",
      "status": "active",
      "delivery_format": [
        "audiobook",
        "pdf",
        "workbook"
      ]
    }
  ],
  "contact": {
    "support_email": "support@example-digital-publisher.example"
  },
  "last_updated": "2026-09-19T12:00:00Z"
}
